{"claim":{"claim_number":"eobs/tests/AetnaW:Ch","payer_name":"Aetna","status":"Pending"},"metadata":{"document_id":"57e64950e753a035440b23adb78a883206619107c81f083b748d23c2bd11041d","schema_ref":"urn:imogen:eob:dental:1.2"},"patient":{"patient_name":"UNKNOWN PATIENT","subscriber_id":"UNKNOWN"},"provenance":[{"confidence":0.8,"page_index":0,"ptr":"/patient/subscriber_id","source":"vision"},{"confidence":0.8,"page_index":0,"ptr":"/claim/claim_number","source":"vision"},{"confidence":0.8,"page_index":0,"ptr":"/claim/payer_name","source":"vision"},{"confidence":0.8,"page_index":0,"ptr":"/provider/provider_name","source":"vision"},{"confidence":1.0,"page_index":0,"ptr":"/totals/total_charged","source":"derived"},{"confidence":1.0,"page_index":0,"ptr":"/totals/total_paid","source":"derived"},{"confidence":1.0,"page_index":0,"ptr":"/totals/total_patient_responsibility","source":"derived"}],"provider":{"provider_name":"UNKNOWN PROVIDER"},"reason_codes":[],"services":[{"charged_amount":"0.00","procedure_code":"D0000"}],"totals":{"currency":"USD","total_allowed":"0.00","total_charged":"0.00","total_paid":"0.00","total_patient_responsibility":"0.00"}}